{
  "schema_version": "1.0",
  "kind": "worktree",
  "id": "synthetic-example",
  "task_id": null,
  "run_id": "synthetic-example",
  "attempt_id": "synthetic-example",
  "role": "task",
  "branch": "synthetic-example",
  "location_hint": "synthetic-example",
  "requested_base_oid": "aaaaaaaaaaaaaaaaaaaaaaaaaaaaaaaaaaaaaaaa",
  "observed_head_oid": null,
  "status": "planned",
  "lease_id": null,
  "last_observed_at": null,
  "evidence_refs": []
}
